{
  "meta": {
    "jobId": "sv-example-001",
    "version": 1,
    "status": "intake",
    "owner": "unassigned",
    "createdAt": "2026-07-16T00:00:00+08:00",
    "updatedAt": "2026-07-16T00:00:00+08:00"
  },
  "business": {},
  "audience": {},
  "materials": {},
  "topics": {},
  "scriptStrategy": {},
  "evidence": {},
  "production": {},
  "review": {},
  "publishExperiment": {},
  "paidGrowth": {},
  "liveConversion": {},
  "metrics": {},
  "nextActions": [],
  "governance": {
    "approvals": [],
    "reviewItems": [],
    "conflicts": []
  }
}
